{
  "derived": {
    "sonar_delta": {
      "bugs": -27.0,
      "code_smells": -11.0,
      "coverage": 0.0,
      "duplicated_lines_density": -3.1,
      "ncloc": 94.0,
      "sqale_index": -128.0,
      "vulnerabilities": 0.0
    }
  },
  "diagram": {
    "path": null,
    "sha256": "49c2c9265a7afc78668fd8a6f6d93d5840a9440c49bde54fea3189dc464b9275"
  },
  "extensions": {},
  "finished_at": "2026-02-26T09:58:03Z",
  "provenance": {
    "source_root": null,
    "source_run_file": "20260226T093210Z__reactor_BlockHound__BlockHound/outputs/experiment.json"
  },
  "run_id": "20260226T093210Z__reactor_BlockHound__BlockHound",
  "schema_version": "run.v1",
  "source": {
    "display_name": "reactor/BlockHound",
    "git": {
      "commit": "283f49cca1b01fea2851e94dd7291b148fe39656",
      "remote": "https://github.com/reactor/BlockHound.git"
    },
    "key": "reactor_BlockHound",
    "normalized_ref": "https://github.com/reactor/BlockHound.git",
    "raw": "https://github.com/reactor/BlockHound.git",
    "subdir": "agent",
    "type": "url"
  },
  "stages": {
    "codegen": {
      "exit_code": 0,
      "metrics": {},
      "status": "passed"
    },
    "sonar": {
      "generated": {
        "ce_task_status": "SUCCESS",
        "measures": {
          "bugs": "2",
          "code_smells": "34",
          "coverage": "0.0",
          "duplicated_lines_density": "0.0",
          "ncloc": "1144",
          "reliability_rating": "2.0",
          "security_rating": "1.0",
          "sqale_index": "292",
          "sqale_rating": "1.0",
          "vulnerabilities": "0"
        },
        "project_key": "reactor_BlockHound__gen__BlockHound__20260226T093210Z",
        "project_name": "reactor/BlockHound [andvari gen:BlockHound @ 20260226T093210Z]",
        "quality_gate": "",
        "scan_data_status": "complete",
        "sonar_task_id": "AZys6wt2pC7_bzFauEPI",
        "sonar_url": "https://sonarcloud.io/dashboard?id=reactor_BlockHound__gen__BlockHound__20260226T093210Z",
        "state_log_dir": null,
        "status": "success"
      },
      "original": {
        "ce_task_status": "SUCCESS",
        "measures": {
          "bugs": "29",
          "code_smells": "45",
          "coverage": "0.0",
          "duplicated_lines_density": "3.1",
          "ncloc": "1050",
          "reliability_rating": "2.0",
          "security_rating": "1.0",
          "sqale_index": "420",
          "sqale_rating": "1.0",
          "vulnerabilities": "0"
        },
        "mode": "auto",
        "project_key": "reactor_BlockHound__subdir__agent",
        "project_name": "reactor/BlockHound [subdir:agent]",
        "quality_gate": "",
        "reused": false,
        "scan_data_status": "complete",
        "sonar_task_id": "AZys-Q280r17oObdMoIs",
        "sonar_url": "https://sonarcloud.io/dashboard?id=reactor_BlockHound__subdir__agent",
        "state_log_dir": null,
        "status": "failed"
      }
    },
    "test_port": {
      "behavioral_verdict": "invalid",
      "failure_class": "write-scope-violation",
      "reason": "write-scope-violation",
      "status": "failed",
      "suite_changes": {
        "added": 1,
        "deleted": 0,
        "modified": 1,
        "total": 2
      },
      "suite_shape": {
        "final_ported_test_file_count": 3,
        "original_snapshot_file_count": 2,
        "retention_ratio": 1.5
      }
    }
  },
  "started_at": "2026-02-26T09:32:10Z",
  "status": "failed"
}
