{
  "derived": {
    "sonar_delta": {
      "bugs": -3.0,
      "code_smells": -1183.0,
      "coverage": 0.0,
      "duplicated_lines_density": -2.8,
      "ncloc": -16703.0,
      "sqale_index": -3459.0,
      "vulnerabilities": 0.0
    }
  },
  "diagram": {
    "path": null,
    "sha256": "2658371f449181e7af9cd4835a62c9e1189b7d3ce73726afe4e9182decd1dfd2"
  },
  "extensions": {},
  "finished_at": "2026-03-02T04:24:26Z",
  "provenance": {
    "source_root": null,
    "source_run_file": "20260302T035307Z__pengrad_java-telegram-bot-api__java-telegram-bot-api/outputs/experiment.json"
  },
  "run_id": "20260302T035307Z__pengrad_java-telegram-bot-api__java-telegram-bot-api",
  "schema_version": "run.v1",
  "source": {
    "display_name": "pengrad/java-telegram-bot-api",
    "git": {
      "commit": "1bdd2e059e63e6598ad842565b220b4b156f4253",
      "remote": "https://github.com/pengrad/java-telegram-bot-api.git"
    },
    "key": "pengrad_java-telegram-bot-api",
    "normalized_ref": "https://github.com/pengrad/java-telegram-bot-api.git",
    "raw": "https://github.com/pengrad/java-telegram-bot-api.git",
    "subdir": "library",
    "type": "url"
  },
  "stages": {
    "codegen": {
      "exit_code": 0,
      "metrics": {},
      "status": "passed"
    },
    "sonar": {
      "generated": {
        "ce_task_status": "SUCCESS",
        "measures": {
          "bugs": "0",
          "code_smells": "373",
          "coverage": "0.0",
          "duplicated_lines_density": "0.0",
          "ncloc": "2177",
          "reliability_rating": "1.0",
          "security_rating": "1.0",
          "sqale_index": "1857",
          "sqale_rating": "1.0",
          "vulnerabilities": "0"
        },
        "project_key": "pengrad_java-telegram-bot-api__gen__java-telegram-bot-api__20260302T035307Z",
        "project_name": "pengrad/java-telegram-bot-api [andvari gen:java-telegram-bot-api @ 20260302T035307Z]",
        "quality_gate": "",
        "scan_data_status": "complete",
        "sonar_task_id": "AZysykfMME1HHBSdqFk_",
        "sonar_url": "https://sonarcloud.io/dashboard?id=pengrad_java-telegram-bot-api__gen__java-telegram-bot-api__20260302T035307Z",
        "state_log_dir": null,
        "status": "success"
      },
      "original": {
        "ce_task_status": "SUCCESS",
        "measures": {
          "bugs": "3",
          "code_smells": "1556",
          "coverage": "0.0",
          "duplicated_lines_density": "2.8",
          "ncloc": "18880",
          "reliability_rating": "3.0",
          "security_rating": "1.0",
          "sqale_index": "5316",
          "sqale_rating": "1.0",
          "vulnerabilities": "0"
        },
        "mode": "auto",
        "project_key": "pengrad_java-telegram-bot-api__subdir__library",
        "project_name": "pengrad/java-telegram-bot-api [subdir:library]",
        "quality_gate": "",
        "reused": false,
        "scan_data_status": "complete",
        "sonar_task_id": "AZytAhQUryd7nXD_DnWt",
        "sonar_url": "https://sonarcloud.io/dashboard?id=pengrad_java-telegram-bot-api__subdir__library",
        "state_log_dir": null,
        "status": "failed"
      }
    },
    "test_port": {
      "adapter": {
        "events_log": "test-port/logs/adapter-events.jsonl",
        "last_message_path": "test-port/logs/adapter-last-message.md",
        "stderr_log": "test-port/logs/adapter-stderr.log"
      },
      "adapter_prereqs_ok": true,
      "artifacts": {
        "adapter_events_log": "test-port/logs/adapter-events.jsonl",
        "adapter_last_message_path": "test-port/logs/adapter-last-message.md",
        "adapter_stderr_log": "test-port/logs/adapter-stderr.log",
        "logs_dir": "test-port/logs",
        "outputs_dir": "test-port/outputs",
        "run_dir": "test-port",
        "summary_md": "test-port/outputs/summary.md",
        "tool_json_path": "test-port/outputs/test_port.json",
        "tool_log_path": "logs/test-port-tool.log",
        "tool_run_dir": "test-port",
        "tool_summary_path": "test-port/outputs/summary.md",
        "workspace_dir": "test-port/workspace"
      },
      "baseline_generated_tests": {
        "exit_code": 0,
        "failure_class": null,
        "failure_type": null,
        "log_path": "test-port/logs/baseline-generated-tests.log",
        "status": "pass",
        "strategy": null
      },
      "baseline_original_tests": {
        "exit_code": 1,
        "failure_class": null,
        "failure_type": null,
        "log_path": "test-port/logs/baseline-original-tests.log",
        "status": "fail",
        "strategy": null
      },
      "behavioral_evidence": {
        "failing_case_count": 0,
        "failing_case_occurrence_count": 0,
        "failing_case_unique_count": 0,
        "failing_cases": [],
        "grouped_failing_cases": [],
        "grouped_truncated": null,
        "junit_report_count": 0,
        "junit_report_files": [],
        "truncated": false
      },
      "behavioral_verdict": "invalid",
      "behavioral_verdict_reason": "write-scope-violation",
      "enabled": true,
      "failure_class": "write-scope-violation",
      "informational": true,
      "new_repo_unchanged": true,
      "ported_original_tests": {
        "adapter_nonzero_runs": 0,
        "exit_code": 1,
        "iterations_used": 0,
        "log_path": null,
        "status": "fail"
      },
      "reason": "write-scope-violation",
      "removed_original_tests": [],
      "retention_policy": {
        "documented_removals_required": null,
        "manifest_rel_path": null,
        "mode": null,
        "undocumented_removed_test_count": null
      },
      "status": "failed",
      "suite_changes": {
        "added": 1,
        "deleted": 0,
        "modified": 37,
        "total": 38
      },
      "suite_shape": {
        "final_ported_test_file_count": 51,
        "original_snapshot_file_count": 50,
        "removed_original_test_file_count": null,
        "retained_original_test_file_count": null,
        "retention_ratio": 1.02
      },
      "write_scope": {
        "change_set_path": "test-port/workspace/write-guards/ported-protected-change-set.tsv",
        "diff_path": "test-port/workspace/write-guards/disallowed-change.diff",
        "ignored_prefixes": [],
        "policy": "tests-only",
        "violation_count": 3,
        "violations": [
          {
            "kind": "M",
            "path": "./completion/proof/logs/hard_reconstruction_gate.log"
          },
          {
            "kind": "M",
            "path": "./completion/proof/logs/runner_replay.log"
          },
          {
            "kind": "M",
            "path": "./completion/proof/logs/test_suite_shape.log"
          }
        ],
        "violations_log_path": "test-port/workspace/summaries/last-write-scope-failure.txt"
      }
    }
  },
  "started_at": "2026-03-02T03:53:07Z",
  "status": "failed"
}
