{
  "derived": {
    "sonar_delta": {
      "bugs": -7.0,
      "code_smells": -722.0,
      "coverage": 0.0,
      "duplicated_lines_density": 0.0,
      "ncloc": -5827.0,
      "sqale_index": -3173.0,
      "vulnerabilities": 0.0
    }
  },
  "diagram": {
    "path": null,
    "sha256": "80515885fb91048a6cdebd22770ab043a7a1f2df9ddf16610d326a9b518452a6"
  },
  "extensions": {},
  "finished_at": "2026-02-25T08:00:23Z",
  "provenance": {
    "source_root": null,
    "source_run_file": "20260225T070300Z__logfellow_logstash-logback-encoder__logstash-logback-encoder/outputs/experiment.json"
  },
  "run_id": "20260225T070300Z__logfellow_logstash-logback-encoder__logstash-logback-encoder",
  "schema_version": "run.v1",
  "source": {
    "display_name": "logfellow/logstash-logback-encoder",
    "git": {
      "commit": "5ea5ec1badd5d8e3cf35219d8f155b95f398b287",
      "remote": "https://github.com/logfellow/logstash-logback-encoder.git"
    },
    "key": "logfellow_logstash-logback-encoder",
    "normalized_ref": "https://github.com/logfellow/logstash-logback-encoder.git",
    "raw": "https://github.com/logfellow/logstash-logback-encoder.git",
    "subdir": "",
    "type": "url"
  },
  "stages": {
    "codegen": {
      "exit_code": 0,
      "metrics": {},
      "status": "passed"
    },
    "sonar": {
      "generated": {
        "ce_task_status": "SUCCESS",
        "measures": {
          "bugs": "8",
          "code_smells": "140",
          "coverage": "0.0",
          "duplicated_lines_density": "3.1",
          "ncloc": "5861",
          "reliability_rating": "5.0",
          "security_rating": "1.0",
          "sqale_index": "1220",
          "sqale_rating": "1.0",
          "vulnerabilities": "0"
        },
        "project_key": "logfellow_logstash-logback-encoder__gen__logstash-logback-encoder__20260225T070300Z",
        "project_name": "logfellow/logstash-logback-encoder [andvari gen:logstash-logback-encoder @ 20260225T070300Z]",
        "quality_gate": "",
        "scan_data_status": "complete",
        "sonar_task_id": "AZyT0C3-h0-kLm35TpvX",
        "sonar_url": "https://sonarcloud.io/dashboard?id=logfellow_logstash-logback-encoder__gen__logstash-logback-encoder__20260225T070300Z",
        "state_log_dir": null,
        "status": "success"
      },
      "original": {
        "ce_task_status": "SUCCESS",
        "measures": {
          "bugs": "15",
          "code_smells": "862",
          "coverage": "0.0",
          "duplicated_lines_density": "3.1",
          "ncloc": "11688",
          "reliability_rating": "4.0",
          "security_rating": "1.0",
          "sqale_index": "4393",
          "sqale_rating": "1.0",
          "vulnerabilities": "0"
        },
        "mode": "auto",
        "project_key": "logfellow_logstash-logback-encoder",
        "project_name": "logfellow/logstash-logback-encoder",
        "quality_gate": "",
        "reused": true,
        "scan_data_status": "complete",
        "sonar_task_id": "AZyTc95Bh0-kLm35Tm0G",
        "sonar_url": "https://sonarcloud.io/dashboard?id=logfellow_logstash-logback-encoder",
        "state_log_dir": null,
        "status": "success"
      }
    },
    "test_port": {
      "adapter": {
        "events_log": "logs/test-port/adapter-events.jsonl",
        "last_message_path": "logs/test-port/adapter-last-message.md",
        "stderr_log": "logs/test-port/adapter-stderr.log"
      },
      "adapter_prereqs_ok": true,
      "artifacts": {
        "adapter_events_log": "logs/test-port/adapter-events.jsonl",
        "adapter_last_message_path": "logs/test-port/adapter-last-message.md",
        "adapter_stderr_log": "logs/test-port/adapter-stderr.log",
        "logs_dir": null,
        "outputs_dir": null,
        "run_dir": null,
        "summary_md": null,
        "tool_json_path": null,
        "tool_log_path": null,
        "tool_run_dir": null,
        "tool_summary_path": null,
        "workspace_dir": null
      },
      "baseline_generated_tests": {
        "exit_code": 0,
        "failure_class": null,
        "failure_type": null,
        "log_path": "logs/test-port/baseline-generated-tests.log",
        "status": "pass",
        "strategy": null
      },
      "baseline_original_tests": {
        "exit_code": 0,
        "failure_class": null,
        "failure_type": null,
        "log_path": "logs/test-port/baseline-original-tests.log",
        "status": "pass",
        "strategy": null
      },
      "behavioral_evidence": {
        "failing_case_count": null,
        "failing_case_occurrence_count": null,
        "failing_case_unique_count": null,
        "failing_cases": [],
        "grouped_failing_cases": [],
        "grouped_truncated": null,
        "junit_report_count": null,
        "junit_report_files": [],
        "truncated": null
      },
      "behavioral_verdict": null,
      "behavioral_verdict_reason": null,
      "enabled": true,
      "failure_class": null,
      "informational": true,
      "new_repo_unchanged": true,
      "ported_original_tests": {
        "adapter_nonzero_runs": 0,
        "exit_code": 0,
        "iterations_used": 0,
        "log_path": "logs/test-port/adapt-iter-0.log",
        "status": "pass"
      },
      "reason": "",
      "removed_original_tests": [],
      "retention_policy": {
        "documented_removals_required": null,
        "manifest_rel_path": null,
        "mode": null,
        "undocumented_removed_test_count": null
      },
      "status": "passed",
      "suite_changes": {
        "added": 0,
        "deleted": 0,
        "modified": 0,
        "total": 0
      },
      "suite_shape": {
        "final_ported_test_file_count": 0,
        "original_snapshot_file_count": 0,
        "removed_original_test_file_count": null,
        "retained_original_test_file_count": null,
        "retention_ratio": null
      },
      "write_scope": {
        "change_set_path": null,
        "diff_path": "workspace/test-port/write-guards/disallowed-change.diff",
        "ignored_prefixes": [],
        "policy": "tests-only",
        "violation_count": 0,
        "violations": [],
        "violations_log_path": "workspace/test-port/summaries/last-write-scope-failure.txt"
      }
    }
  },
  "started_at": "2026-02-25T07:03:00Z",
  "status": "completed"
}
