{
  "derived": {
    "sonar_delta": {
      "bugs": -3.0,
      "code_smells": -116.0,
      "coverage": 0.0,
      "duplicated_lines_density": -5.0,
      "ncloc": -3737.0,
      "sqale_index": -627.0,
      "vulnerabilities": 0.0
    }
  },
  "diagram": {
    "path": null,
    "sha256": "44467ed96d3ab57994781cd7307e6c435c831506d65795c38ea899df352725d2"
  },
  "extensions": {},
  "finished_at": "2026-03-02T03:53:06Z",
  "provenance": {
    "source_root": null,
    "source_run_file": "20260302T024507Z__json-path_JsonPath__JsonPath/outputs/experiment.json"
  },
  "run_id": "20260302T024507Z__json-path_JsonPath__JsonPath",
  "schema_version": "run.v1",
  "source": {
    "display_name": "json-path/JsonPath",
    "git": {
      "commit": "62a4c9f0f65ba3f625aa0867d64c528ba72d09ec",
      "remote": "https://github.com/json-path/JsonPath.git"
    },
    "key": "json-path_JsonPath",
    "normalized_ref": "https://github.com/json-path/JsonPath.git",
    "raw": "https://github.com/json-path/JsonPath.git",
    "subdir": "json-path",
    "type": "url"
  },
  "stages": {
    "codegen": {
      "exit_code": 0,
      "metrics": {},
      "status": "passed"
    },
    "sonar": {
      "generated": {
        "ce_task_status": "",
        "measures": {
          "bugs": "12",
          "code_smells": "106",
          "coverage": "0.0",
          "duplicated_lines_density": "0.0",
          "ncloc": "6087",
          "reliability_rating": "2.0",
          "security_rating": "1.0",
          "sqale_index": "1183",
          "sqale_rating": "1.0",
          "vulnerabilities": "0"
        },
        "project_key": "json-path_JsonPath__gen__JsonPath__20260302T024507Z",
        "project_name": "json-path/JsonPath [andvari gen:JsonPath @ 20260302T024507Z]",
        "quality_gate": "",
        "scan_data_status": "complete",
        "sonar_task_id": "",
        "sonar_url": "https://sonarcloud.io/dashboard?id=json-path_JsonPath__gen__JsonPath__20260302T024507Z",
        "state_log_dir": null,
        "status": "failed"
      },
      "original": {
        "ce_task_status": "SUCCESS",
        "measures": {
          "bugs": "15",
          "code_smells": "222",
          "coverage": "0.0",
          "duplicated_lines_density": "5.0",
          "ncloc": "9824",
          "reliability_rating": "3.0",
          "security_rating": "1.0",
          "sqale_index": "1810",
          "sqale_rating": "1.0",
          "vulnerabilities": "0"
        },
        "mode": "auto",
        "project_key": "json-path_JsonPath__subdir__json-path",
        "project_name": "json-path/JsonPath [subdir:json-path]",
        "quality_gate": "",
        "reused": false,
        "scan_data_status": "complete",
        "sonar_task_id": "AZys_k8FSeJ-cwClMTaR",
        "sonar_url": "https://sonarcloud.io/dashboard?id=json-path_JsonPath__subdir__json-path",
        "state_log_dir": null,
        "status": "failed"
      }
    },
    "test_port": {
      "adapter": {
        "events_log": "test-port/logs/adapter-events.jsonl",
        "last_message_path": "test-port/logs/adapter-last-message.md",
        "stderr_log": "test-port/logs/adapter-stderr.log"
      },
      "adapter_prereqs_ok": true,
      "artifacts": {
        "adapter_events_log": "test-port/logs/adapter-events.jsonl",
        "adapter_last_message_path": "test-port/logs/adapter-last-message.md",
        "adapter_stderr_log": "test-port/logs/adapter-stderr.log",
        "logs_dir": "test-port/logs",
        "outputs_dir": "test-port/outputs",
        "run_dir": "test-port",
        "summary_md": "test-port/outputs/summary.md",
        "tool_json_path": "test-port/outputs/test_port.json",
        "tool_log_path": "logs/test-port-tool.log",
        "tool_run_dir": "test-port",
        "tool_summary_path": "test-port/outputs/summary.md",
        "workspace_dir": "test-port/workspace"
      },
      "baseline_generated_tests": {
        "exit_code": 0,
        "failure_class": null,
        "failure_type": null,
        "log_path": "test-port/logs/baseline-generated-tests.log",
        "status": "pass",
        "strategy": null
      },
      "baseline_original_tests": {
        "exit_code": 1,
        "failure_class": null,
        "failure_type": null,
        "log_path": "test-port/logs/baseline-original-tests.log",
        "status": "fail",
        "strategy": null
      },
      "behavioral_evidence": {
        "failing_case_count": 0,
        "failing_case_occurrence_count": 0,
        "failing_case_unique_count": 0,
        "failing_cases": [],
        "grouped_failing_cases": [],
        "grouped_truncated": null,
        "junit_report_count": 0,
        "junit_report_files": [],
        "truncated": false
      },
      "behavioral_verdict": "inconclusive",
      "behavioral_verdict_reason": "compatibility-build",
      "enabled": true,
      "failure_class": "compatibility-build",
      "informational": true,
      "new_repo_unchanged": true,
      "ported_original_tests": {
        "adapter_nonzero_runs": 0,
        "exit_code": 0,
        "iterations_used": 5,
        "log_path": "test-port/logs/adapt-iter-5.log",
        "status": "pass"
      },
      "reason": "tests-failed",
      "removed_original_tests": [],
      "retention_policy": {
        "documented_removals_required": null,
        "manifest_rel_path": null,
        "mode": null,
        "undocumented_removed_test_count": null
      },
      "status": "failed",
      "suite_changes": {
        "added": 8,
        "deleted": 73,
        "modified": 0,
        "total": 81
      },
      "suite_shape": {
        "final_ported_test_file_count": 17,
        "original_snapshot_file_count": 82,
        "removed_original_test_file_count": null,
        "retained_original_test_file_count": null,
        "retention_ratio": 0.2073170731707317
      },
      "write_scope": {
        "change_set_path": "test-port/workspace/write-guards/ported-protected-change-set.tsv",
        "diff_path": "test-port/workspace/write-guards/disallowed-change.diff",
        "ignored_prefixes": [],
        "policy": "tests-only",
        "violation_count": 0,
        "violations": [],
        "violations_log_path": "test-port/workspace/summaries/last-write-scope-failure.txt"
      }
    }
  },
  "started_at": "2026-03-02T02:45:07Z",
  "status": "failed"
}
