{
  "derived": {
    "sonar_delta": {
      "bugs": -8.0,
      "code_smells": -17.0,
      "coverage": 0.0,
      "duplicated_lines_density": -1.4,
      "ncloc": -334.0,
      "sqale_index": -380.0,
      "vulnerabilities": 0.0
    }
  },
  "diagram": {
    "path": null,
    "sha256": "50e6fb7f16c6a187a730101c04174cdb7283f7542cf420b99716cf76a6146e11"
  },
  "extensions": {},
  "finished_at": "2026-03-02T04:46:17Z",
  "provenance": {
    "source_root": null,
    "source_run_file": "20260302T042426Z__apache_cordova-plugin-inappbrowser__cordova-plugin-inappbrowser/outputs/experiment.json"
  },
  "run_id": "20260302T042426Z__apache_cordova-plugin-inappbrowser__cordova-plugin-inappbrowser",
  "schema_version": "run.v1",
  "source": {
    "display_name": "apache/cordova-plugin-inappbrowser",
    "git": {
      "commit": "b83a9b732005cad6ccda1f23527b90a61dcf5a98",
      "remote": "https://github.com/apache/cordova-plugin-inappbrowser.git"
    },
    "key": "apache_cordova-plugin-inappbrowser",
    "normalized_ref": "https://github.com/apache/cordova-plugin-inappbrowser.git",
    "raw": "https://github.com/apache/cordova-plugin-inappbrowser.git",
    "subdir": "",
    "type": "url"
  },
  "stages": {
    "codegen": {
      "exit_code": 0,
      "metrics": {},
      "status": "passed"
    },
    "sonar": {
      "generated": {
        "ce_task_status": "SUCCESS",
        "measures": {
          "bugs": "0",
          "code_smells": "50",
          "coverage": "0.0",
          "duplicated_lines_density": "0.0",
          "ncloc": "1090",
          "reliability_rating": "1.0",
          "security_rating": "1.0",
          "sqale_index": "364",
          "sqale_rating": "1.0",
          "vulnerabilities": "0"
        },
        "project_key": "apache_cordova-plugin-inappbrowser__gen__cordova-plugin-inappbrowser__20260302T042426Z",
        "project_name": "apache/cordova-plugin-inappbrowser [andvari gen:cordova-plugin-inappbrowser @ 20260302T042426Z]",
        "quality_gate": "",
        "scan_data_status": "complete",
        "sonar_task_id": "AZytAxL3Q-S2adFc82dJ",
        "sonar_url": "https://sonarcloud.io/dashboard?id=apache_cordova-plugin-inappbrowser__gen__cordova-plugin-inappbrowser__20260302T042426Z",
        "state_log_dir": null,
        "status": "failed"
      },
      "original": {
        "ce_task_status": "",
        "measures": {
          "bugs": "8",
          "code_smells": "67",
          "coverage": "0.0",
          "duplicated_lines_density": "1.4",
          "ncloc": "1424",
          "reliability_rating": "3.0",
          "security_rating": "1.0",
          "sqale_index": "744",
          "sqale_rating": "1.0",
          "vulnerabilities": "0"
        },
        "mode": "auto",
        "project_key": "apache_cordova-plugin-inappbrowser",
        "project_name": "apache/cordova-plugin-inappbrowser",
        "quality_gate": "",
        "reused": false,
        "scan_data_status": "complete",
        "sonar_task_id": "",
        "sonar_url": "https://sonarcloud.io/dashboard?id=apache_cordova-plugin-inappbrowser",
        "state_log_dir": null,
        "status": "failed"
      }
    },
    "test_port": {
      "adapter": {
        "events_log": "test-port/logs/adapter-events.jsonl",
        "last_message_path": "test-port/logs/adapter-last-message.md",
        "stderr_log": "test-port/logs/adapter-stderr.log"
      },
      "adapter_prereqs_ok": true,
      "artifacts": {
        "adapter_events_log": "test-port/logs/adapter-events.jsonl",
        "adapter_last_message_path": "test-port/logs/adapter-last-message.md",
        "adapter_stderr_log": "test-port/logs/adapter-stderr.log",
        "logs_dir": "test-port/logs",
        "outputs_dir": "test-port/outputs",
        "run_dir": "test-port",
        "summary_md": "test-port/outputs/summary.md",
        "tool_json_path": "test-port/outputs/test_port.json",
        "tool_log_path": "logs/test-port-tool.log",
        "tool_run_dir": "test-port",
        "tool_summary_path": "test-port/outputs/summary.md",
        "workspace_dir": "test-port/workspace"
      },
      "baseline_generated_tests": {
        "exit_code": 0,
        "failure_class": null,
        "failure_type": null,
        "log_path": "test-port/logs/baseline-generated-tests.log",
        "status": "pass",
        "strategy": null
      },
      "baseline_original_tests": {
        "exit_code": 2,
        "failure_class": null,
        "failure_type": null,
        "log_path": "test-port/logs/baseline-original-tests.log",
        "status": "skipped",
        "strategy": null
      },
      "behavioral_evidence": {
        "failing_case_count": 0,
        "failing_case_occurrence_count": 0,
        "failing_case_unique_count": 0,
        "failing_cases": [],
        "grouped_failing_cases": [],
        "grouped_truncated": null,
        "junit_report_count": 0,
        "junit_report_files": [],
        "truncated": false
      },
      "behavioral_verdict": "no_difference_detected",
      "behavioral_verdict_reason": "retained-ported-tests-pass",
      "enabled": true,
      "failure_class": "",
      "informational": true,
      "new_repo_unchanged": true,
      "ported_original_tests": {
        "adapter_nonzero_runs": 0,
        "exit_code": 0,
        "iterations_used": 0,
        "log_path": "test-port/logs/adapt-iter-0.log",
        "status": "pass"
      },
      "reason": "",
      "removed_original_tests": [],
      "retention_policy": {
        "documented_removals_required": null,
        "manifest_rel_path": null,
        "mode": null,
        "undocumented_removed_test_count": null
      },
      "status": "passed",
      "suite_changes": {
        "added": 4,
        "deleted": 0,
        "modified": 0,
        "total": 4
      },
      "suite_shape": {
        "final_ported_test_file_count": 13,
        "original_snapshot_file_count": 9,
        "removed_original_test_file_count": null,
        "retained_original_test_file_count": null,
        "retention_ratio": 1.4444444444444444
      },
      "write_scope": {
        "change_set_path": "test-port/workspace/write-guards/ported-protected-change-set.tsv",
        "diff_path": "test-port/workspace/write-guards/disallowed-change.diff",
        "ignored_prefixes": [],
        "policy": "tests-only",
        "violation_count": 0,
        "violations": [],
        "violations_log_path": "test-port/workspace/summaries/last-write-scope-failure.txt"
      }
    }
  },
  "started_at": "2026-03-02T04:24:26Z",
  "status": "failed"
}
