{
  "derived": {
    "sonar_delta": {
      "bugs": -3.0,
      "code_smells": -1183.0,
      "coverage": 0.0,
      "duplicated_lines_density": -2.8,
      "ncloc": -16703.0,
      "sqale_index": -3459.0,
      "vulnerabilities": 0.0
    }
  },
  "diagram": {
    "path": null,
    "sha256": "2658371f449181e7af9cd4835a62c9e1189b7d3ce73726afe4e9182decd1dfd2"
  },
  "extensions": {},
  "finished_at": "2026-03-02T04:24:26Z",
  "provenance": {
    "source_root": null,
    "source_run_file": "20260302T035307Z__pengrad_java-telegram-bot-api__java-telegram-bot-api/outputs/experiment.json"
  },
  "run_id": "20260302T035307Z__pengrad_java-telegram-bot-api__java-telegram-bot-api",
  "schema_version": "run.v1",
  "source": {
    "display_name": "pengrad/java-telegram-bot-api",
    "git": {
      "commit": "1bdd2e059e63e6598ad842565b220b4b156f4253",
      "remote": "https://github.com/pengrad/java-telegram-bot-api.git"
    },
    "key": "pengrad_java-telegram-bot-api",
    "normalized_ref": "https://github.com/pengrad/java-telegram-bot-api.git",
    "raw": "https://github.com/pengrad/java-telegram-bot-api.git",
    "subdir": "library",
    "type": "url"
  },
  "stages": {
    "codegen": {
      "exit_code": 0,
      "metrics": {},
      "status": "passed"
    },
    "sonar": {
      "generated": {
        "ce_task_status": "SUCCESS",
        "measures": {
          "bugs": "0",
          "code_smells": "373",
          "coverage": "0.0",
          "duplicated_lines_density": "0.0",
          "ncloc": "2177",
          "reliability_rating": "1.0",
          "security_rating": "1.0",
          "sqale_index": "1857",
          "sqale_rating": "1.0",
          "vulnerabilities": "0"
        },
        "project_key": "pengrad_java-telegram-bot-api__gen__java-telegram-bot-api__20260302T035307Z",
        "project_name": "pengrad/java-telegram-bot-api [andvari gen:java-telegram-bot-api @ 20260302T035307Z]",
        "quality_gate": "",
        "scan_data_status": "complete",
        "sonar_task_id": "AZysykfMME1HHBSdqFk_",
        "sonar_url": "https://sonarcloud.io/dashboard?id=pengrad_java-telegram-bot-api__gen__java-telegram-bot-api__20260302T035307Z",
        "state_log_dir": null,
        "status": "success"
      },
      "original": {
        "ce_task_status": "SUCCESS",
        "measures": {
          "bugs": "3",
          "code_smells": "1556",
          "coverage": "0.0",
          "duplicated_lines_density": "2.8",
          "ncloc": "18880",
          "reliability_rating": "3.0",
          "security_rating": "1.0",
          "sqale_index": "5316",
          "sqale_rating": "1.0",
          "vulnerabilities": "0"
        },
        "mode": "auto",
        "project_key": "pengrad_java-telegram-bot-api__subdir__library",
        "project_name": "pengrad/java-telegram-bot-api [subdir:library]",
        "quality_gate": "",
        "reused": false,
        "scan_data_status": "complete",
        "sonar_task_id": "AZytAhQUryd7nXD_DnWt",
        "sonar_url": "https://sonarcloud.io/dashboard?id=pengrad_java-telegram-bot-api__subdir__library",
        "state_log_dir": null,
        "status": "failed"
      }
    },
    "test_port": {
      "behavioral_verdict": "invalid",
      "failure_class": "write-scope-violation",
      "reason": "write-scope-violation",
      "status": "failed",
      "suite_changes": {
        "added": 1,
        "deleted": 0,
        "modified": 37,
        "total": 38
      },
      "suite_shape": {
        "final_ported_test_file_count": 51,
        "original_snapshot_file_count": 50,
        "retention_ratio": 1.02
      }
    }
  },
  "started_at": "2026-03-02T03:53:07Z",
  "status": "failed"
}
