{
  "derived": {
    "sonar_delta": {
      "bugs": -7.0,
      "code_smells": -43.0,
      "coverage": 0.0,
      "duplicated_lines_density": 0.0,
      "ncloc": -1225.0,
      "sqale_index": -198.0,
      "vulnerabilities": -1.0
    }
  },
  "diagram": {
    "path": null,
    "sha256": "1fef928bea8b6ec883c26614a20dfd9f39abab7e52eaab3c7522189bdd43eb1d"
  },
  "extensions": {},
  "finished_at": "2026-03-02T02:45:06Z",
  "provenance": {
    "source_root": null,
    "source_run_file": "20260226T095803Z__obsidiandynamics_kafdrop__kafdrop/outputs/experiment.json"
  },
  "run_id": "20260226T095803Z__obsidiandynamics_kafdrop__kafdrop",
  "schema_version": "run.v1",
  "source": {
    "display_name": "obsidiandynamics/kafdrop",
    "git": {
      "commit": "29fb9db39a062a2ae785507aaa285d97a085083e",
      "remote": "https://github.com/obsidiandynamics/kafdrop.git"
    },
    "key": "obsidiandynamics_kafdrop",
    "normalized_ref": "https://github.com/obsidiandynamics/kafdrop.git",
    "raw": "https://github.com/obsidiandynamics/kafdrop.git",
    "subdir": "",
    "type": "url"
  },
  "stages": {
    "codegen": {
      "exit_code": 0,
      "metrics": {},
      "status": "passed"
    },
    "sonar": {
      "generated": {
        "ce_task_status": "SUCCESS",
        "measures": {
          "bugs": "2",
          "code_smells": "56",
          "coverage": "0.0",
          "duplicated_lines_density": "0.0",
          "ncloc": "2959",
          "reliability_rating": "5.0",
          "security_rating": "1.0",
          "sqale_index": "457",
          "sqale_rating": "1.0",
          "vulnerabilities": "0"
        },
        "project_key": "obsidiandynamics_kafdrop__gen__kafdrop__20260226T095803Z",
        "project_name": "obsidiandynamics/kafdrop [andvari gen:kafdrop @ 20260226T095803Z]",
        "quality_gate": "",
        "scan_data_status": "complete",
        "sonar_task_id": "AZys69YVFT95F1vSOxF9",
        "sonar_url": "https://sonarcloud.io/dashboard?id=obsidiandynamics_kafdrop__gen__kafdrop__20260226T095803Z",
        "state_log_dir": null,
        "status": "success"
      },
      "original": {
        "ce_task_status": "SUCCESS",
        "measures": {
          "bugs": "9",
          "code_smells": "99",
          "coverage": "0.0",
          "duplicated_lines_density": "0.0",
          "ncloc": "4184",
          "reliability_rating": "3.0",
          "security_rating": "2.0",
          "sqale_index": "655",
          "sqale_rating": "1.0",
          "vulnerabilities": "1"
        },
        "mode": "auto",
        "project_key": "obsidiandynamics_kafdrop",
        "project_name": "obsidiandynamics/kafdrop",
        "quality_gate": "",
        "reused": false,
        "scan_data_status": "complete",
        "sonar_task_id": "AZytBhrX61m2OIsFqOuH",
        "sonar_url": "https://sonarcloud.io/dashboard?id=obsidiandynamics_kafdrop",
        "state_log_dir": null,
        "status": "failed"
      }
    },
    "test_port": {
      "adapter": {
        "events_log": "test-port/logs/adapter-events.jsonl",
        "last_message_path": "test-port/logs/adapter-last-message.md",
        "stderr_log": "test-port/logs/adapter-stderr.log"
      },
      "adapter_prereqs_ok": true,
      "artifacts": {
        "adapter_events_log": "test-port/logs/adapter-events.jsonl",
        "adapter_last_message_path": "test-port/logs/adapter-last-message.md",
        "adapter_stderr_log": "test-port/logs/adapter-stderr.log",
        "logs_dir": "test-port/logs",
        "outputs_dir": "test-port/outputs",
        "run_dir": "test-port",
        "summary_md": "test-port/outputs/summary.md",
        "tool_json_path": "test-port/outputs/test_port.json",
        "tool_log_path": "logs/test-port-tool.log",
        "tool_run_dir": "test-port",
        "tool_summary_path": "test-port/outputs/summary.md",
        "workspace_dir": "test-port/workspace"
      },
      "baseline_generated_tests": {
        "exit_code": 0,
        "failure_class": null,
        "failure_type": null,
        "log_path": "test-port/logs/baseline-generated-tests.log",
        "status": "pass",
        "strategy": null
      },
      "baseline_original_tests": {
        "exit_code": 1,
        "failure_class": null,
        "failure_type": null,
        "log_path": "test-port/logs/baseline-original-tests.log",
        "status": "fail",
        "strategy": null
      },
      "behavioral_evidence": {
        "failing_case_count": 0,
        "failing_case_occurrence_count": 0,
        "failing_case_unique_count": 0,
        "failing_cases": [],
        "grouped_failing_cases": [],
        "grouped_truncated": null,
        "junit_report_count": 3,
        "junit_report_files": [
          "target/surefire-reports/TEST-kafdrop.config.ini.IniFileReaderTest.xml",
          "target/surefire-reports/TEST-kafdrop.service.KafkaMonitorControllerIntegrationTest.xml",
          "target/surefire-reports/TEST-kafdrop.util.SerdeUtilitiesTest.xml"
        ],
        "truncated": false
      },
      "behavioral_verdict": "inconclusive",
      "behavioral_verdict_reason": "compatibility-build",
      "enabled": true,
      "failure_class": "compatibility-build",
      "informational": true,
      "new_repo_unchanged": true,
      "ported_original_tests": {
        "adapter_nonzero_runs": 6,
        "exit_code": 0,
        "iterations_used": 5,
        "log_path": "test-port/logs/adapt-iter-5.log",
        "status": "pass"
      },
      "reason": "tests-failed",
      "removed_original_tests": [],
      "retention_policy": {
        "documented_removals_required": null,
        "manifest_rel_path": null,
        "mode": null,
        "undocumented_removed_test_count": null
      },
      "status": "failed",
      "suite_changes": {
        "added": 0,
        "deleted": 0,
        "modified": 0,
        "total": 0
      },
      "suite_shape": {
        "final_ported_test_file_count": 14,
        "original_snapshot_file_count": 14,
        "removed_original_test_file_count": null,
        "retained_original_test_file_count": null,
        "retention_ratio": 1.0
      },
      "write_scope": {
        "change_set_path": "test-port/workspace/write-guards/ported-protected-change-set.tsv",
        "diff_path": "test-port/workspace/write-guards/disallowed-change.diff",
        "ignored_prefixes": [],
        "policy": "tests-only",
        "violation_count": 0,
        "violations": [],
        "violations_log_path": "test-port/workspace/summaries/last-write-scope-failure.txt"
      }
    }
  },
  "started_at": "2026-02-26T09:58:03Z",
  "status": "failed"
}
