{
  "derived": {
    "sonar_delta": {
      "bugs": -7.0,
      "code_smells": -43.0,
      "coverage": 0.0,
      "duplicated_lines_density": 0.0,
      "ncloc": -1225.0,
      "sqale_index": -198.0,
      "vulnerabilities": -1.0
    }
  },
  "diagram": {
    "path": null,
    "sha256": "1fef928bea8b6ec883c26614a20dfd9f39abab7e52eaab3c7522189bdd43eb1d"
  },
  "extensions": {},
  "finished_at": "2026-03-02T02:45:06Z",
  "provenance": {
    "source_root": null,
    "source_run_file": "20260226T095803Z__obsidiandynamics_kafdrop__kafdrop/outputs/experiment.json"
  },
  "run_id": "20260226T095803Z__obsidiandynamics_kafdrop__kafdrop",
  "schema_version": "run.v1",
  "source": {
    "display_name": "obsidiandynamics/kafdrop",
    "git": {
      "commit": "29fb9db39a062a2ae785507aaa285d97a085083e",
      "remote": "https://github.com/obsidiandynamics/kafdrop.git"
    },
    "key": "obsidiandynamics_kafdrop",
    "normalized_ref": "https://github.com/obsidiandynamics/kafdrop.git",
    "raw": "https://github.com/obsidiandynamics/kafdrop.git",
    "subdir": "",
    "type": "url"
  },
  "stages": {
    "codegen": {
      "exit_code": 0,
      "metrics": {},
      "status": "passed"
    },
    "sonar": {
      "generated": {
        "ce_task_status": "SUCCESS",
        "measures": {
          "bugs": "2",
          "code_smells": "56",
          "coverage": "0.0",
          "duplicated_lines_density": "0.0",
          "ncloc": "2959",
          "reliability_rating": "5.0",
          "security_rating": "1.0",
          "sqale_index": "457",
          "sqale_rating": "1.0",
          "vulnerabilities": "0"
        },
        "project_key": "obsidiandynamics_kafdrop__gen__kafdrop__20260226T095803Z",
        "project_name": "obsidiandynamics/kafdrop [andvari gen:kafdrop @ 20260226T095803Z]",
        "quality_gate": "",
        "scan_data_status": "complete",
        "sonar_task_id": "AZys69YVFT95F1vSOxF9",
        "sonar_url": "https://sonarcloud.io/dashboard?id=obsidiandynamics_kafdrop__gen__kafdrop__20260226T095803Z",
        "state_log_dir": null,
        "status": "success"
      },
      "original": {
        "ce_task_status": "SUCCESS",
        "measures": {
          "bugs": "9",
          "code_smells": "99",
          "coverage": "0.0",
          "duplicated_lines_density": "0.0",
          "ncloc": "4184",
          "reliability_rating": "3.0",
          "security_rating": "2.0",
          "sqale_index": "655",
          "sqale_rating": "1.0",
          "vulnerabilities": "1"
        },
        "mode": "auto",
        "project_key": "obsidiandynamics_kafdrop",
        "project_name": "obsidiandynamics/kafdrop",
        "quality_gate": "",
        "reused": false,
        "scan_data_status": "complete",
        "sonar_task_id": "AZytBhrX61m2OIsFqOuH",
        "sonar_url": "https://sonarcloud.io/dashboard?id=obsidiandynamics_kafdrop",
        "state_log_dir": null,
        "status": "failed"
      }
    },
    "test_port": {
      "behavioral_verdict": "inconclusive",
      "failure_class": "compatibility-build",
      "reason": "tests-failed",
      "status": "failed",
      "suite_changes": {
        "added": 0,
        "deleted": 0,
        "modified": 0,
        "total": 0
      },
      "suite_shape": {
        "final_ported_test_file_count": 14,
        "original_snapshot_file_count": 14,
        "retention_ratio": 1.0
      }
    }
  },
  "started_at": "2026-02-26T09:58:03Z",
  "status": "failed"
}
